{
  "schema_version": 1,
  "identity": {
    "name": "abs",
    "category": "elementwise"
  },
  "semantics": {
    "arity": 1,
    "kinds": ["unary", "elementwise", "nonlinear", "piecewise"],
    "expression": "y = |x|"
  },
  "tensor": {
    "input_count": 1,
    "output_count": 1,
    "input_shapes": ["X[d0, ..., dn]"],
    "output_shape_rule": "shape(Y) = shape(X)",
    "shape_preserving": true,
    "rank_preserving": true,
    "shape_changing": false,
    "rank_changing": false,
    "supports_broadcast": false,
    "uses_reduction_axis": false,
    "uses_permutation": false,
    "layout_sensitive": false,
    "element_independent": true,
    "cross_element": false,
    "cross_row": false,
    "cross_channel": false,
    "broadcast_axes": [],
    "reduction_axes": [],
    "permutation": [],
    "input_layout": null,
    "output_layout": null
  },
  "algebra": {
    "commutative": null,
    "mathematically_associative": null,
    "distributive": null,
    "idempotent": true,
    "zero_preserving": true,
    "one_preserving": true,
    "monotonic": false,
    "monotonic_direction": "not_monotonic",
    "invertible": false,
    "has_identity": null,
    "identity_value": null,
    "has_annihilator": null,
    "annihilator_value": null
  },
  "numerical": {
    "approximate_intrinsic": false,
    "accumulation_sensitive": false,
    "overflow_sensitive": false,
    "underflow_sensitive": false,
    "cancellation_sensitive": false,
    "nan_sensitive": true,
    "inf_sensitive": true,
    "epsilon_required": false,
    "mixed_precision_safe": null,
    "floating_point_reassociation_safe": true,
    "domain_constraints": []
  },
  "fusion": {
    "producer_fusible": true,
    "consumer_fusible": true,
    "epilogue_fusible": true,
    "prologue_fusible": true,
    "requires_materialization": false,
    "requires_global_sync": false,
    "has_side_effect": false,
    "cheap_to_recompute": true,
    "expensive_to_recompute": false,
    "conditions": [
      "The fused schedule preserves the one-to-one output element mapping.",
      "No consumer requires the unfused intermediate to be materialized.",
      "The fused numerical policy preserves fabsf special-value behavior."
    ]
  },
  "decomposition": [],
  "evidence": [
    {
      "kind": "source",
      "file": "operators/abs/abs.cu",
      "locator": "abs_fp32 body, source line 34",
      "match": "output[index] = fabsf(input[index]);",
      "observation": "The source declares unary elementwise absolute value."
    },
    {
      "kind": "source",
      "file": "operators/abs/abs.cu",
      "locator": "abs_fp32 index calculation, source line 32",
      "match": "const int index = blockIdx.x * blockDim.x + threadIdx.x;",
      "observation": "A flat input index maps to the same output index."
    }
  ],
  "implementations": [
    {
      "name": "fp32_scalar",
      "source": {
        "file": "operators/abs/abs.cu",
        "kernel": "abs_fp32",
        "evidence": [
          {
            "kind": "source",
            "file": "operators/abs/abs.cu",
            "locator": "kernel declaration, source line 30",
            "match": "__global__ void abs_fp32(const float* input, float* output,",
            "observation": "The implementation is a single FP32 CUDA kernel."
          }
        ]
      },
      "dtype": {
        "inputs": ["fp32"],
        "output": "fp32",
        "accumulation": null
      },
      "validation": {
        "reference": "std::abs(input[i])",
        "reference_precision": "fp32",
        "absolute_tolerance": 0.0,
        "relative_tolerance": 0.0,
        "evidence": [
          {
            "kind": "source",
            "file": "operators/abs/abs.cu",
            "locator": "validation reference, source line 130",
            "match": "const float reference = std::abs(input[i]);",
            "observation": "Validation uses an FP32 absolute-value reference."
          },
          {
            "kind": "source",
            "file": "operators/abs/abs.cu",
            "locator": "validation tolerances, source lines 18-19",
            "match": "constexpr float kAbsoluteTolerance = 0.0F;",
            "observation": "The absolute tolerance is zero; the adjacent relative tolerance is also zero."
          }
        ]
      },
      "launch": {
        "threads_per_block": 256,
        "grid_rule": "ceil(element_count / 256)",
        "elements_per_thread": 1,
        "evidence": [
          {
            "kind": "source",
            "file": "operators/abs/abs.cu",
            "locator": "launch configuration, source lines 17 and 69-70",
            "match": "constexpr int kThreads = 256;",
            "observation": "The block size is fixed at 256 threads and blocks_for implements ceiling division."
          }
        ]
      },
      "codegen": {
        "declared": {
          "properties": {
            "scalar_io": true,
            "vector_width": 1,
            "uses_fast_math": false
          },
          "evidence": [
            {
              "kind": "source",
              "file": "tools/cuda_artifacts/extract.ps1",
              "locator": "commonArguments",
              "match": "$commonArguments = @",
              "observation": "Artifact generation uses the common O3 command without --use_fast_math."
            }
          ]
        },
        "observed": {
          "properties": {
            "scalar_global_load_store": true,
            "bounds_exit_predicate": true,
            "uses_fast_math": null
          },
          "evidence": [
            {
              "kind": "sass",
              "file": "operators/abs/artifacts/abs.sass",
              "locator": "instruction offsets 0x0040-0x00c0",
              "match": "FADD R7, |R2|, -RZ",
              "observation": "The cubin contains a bounds predicate, scalar global access, and absolute source modifier."
            }
          ]
        },
        "inferred": {
          "properties": {
            "scalar_lowering_confirmed": true,
            "source_operation_lowering_supported": true
          },
          "evidence": [
            {
              "kind": "sass",
              "file": "operators/abs/artifacts/abs.sass",
              "locator": "instruction offset 0x00b0",
              "match": "FADD R7, |R2|, -RZ",
              "observation": "The absolute operand modifier supports the declared fabsf lowering; it does not establish semantics alone."
            }
          ]
        }
      },
      "hardware": {
        "declared": {
          "properties": {
            "uses_cuda_core": true,
            "uses_tensor_core": false,
            "uses_sfu": false,
            "uses_shared_memory": false,
            "uses_constant_memory": false,
            "uses_local_memory": false,
            "uses_warp_shuffle": false,
            "uses_warp_vote": false,
            "uses_barrier": false,
            "uses_atomic": false,
            "uses_async_copy": false,
            "uses_vector_load": false,
            "uses_vector_store": false
          },
          "evidence": [
            {
              "kind": "source",
              "file": "operators/abs/abs.cu",
              "locator": "abs_fp32 body, source lines 30-35",
              "match": "output[index] = fabsf(input[index]);",
              "observation": "The scalar source declares no Tensor Core, SFU, shared-memory, synchronization, atomic, or vector operation."
            }
          ]
        },
        "observed": {
          "properties": {
            "uses_cuda_core": true,
            "uses_tensor_core": false,
            "uses_sfu": false,
            "uses_shared_memory": false,
            "uses_constant_memory": null,
            "uses_local_memory": false,
            "uses_warp_shuffle": false,
            "uses_warp_vote": false,
            "uses_barrier": false,
            "uses_atomic": false,
            "uses_async_copy": false,
            "uses_vector_load": false,
            "uses_vector_store": false
          },
          "evidence": [
            {
              "kind": "sass",
              "file": "operators/abs/artifacts/abs.sass",
              "locator": "abs_fp32 static instruction stream",
              "match": "FADD R7, |R2|, -RZ",
              "observation": "FADD is observed and HMMA, MUFU, LDS/STS, BAR, ATOM, SHFL, and vector memory instructions are absent. Constant-bank kernel parameter access is not classified as explicit constant-memory use."
            }
          ]
        },
        "inferred": {
          "properties": {
            "uses_cuda_core": true,
            "uses_tensor_core": false,
            "uses_sfu": false,
            "uses_shared_memory": false,
            "uses_constant_memory": null,
            "uses_local_memory": false,
            "uses_warp_shuffle": false,
            "uses_warp_vote": false,
            "uses_barrier": false,
            "uses_atomic": false,
            "uses_async_copy": false,
            "uses_vector_load": false,
            "uses_vector_store": false
          },
          "evidence": [
            {
              "kind": "sass",
              "file": "operators/abs/runtime/abs_detailed_sass.txt",
              "locator": "runtime-mapped arithmetic instruction",
              "match": "FADD R7, |R2|, -RZ",
              "observation": "Runtime Source/SASS mapping confirms execution of the non-Tensor-Core scalar lowering."
            }
          ]
        }
      },
      "memory": {
        "declared": {
          "properties": {
            "global_read": true,
            "global_write": true,
            "coalesced_read": true,
            "coalesced_write": true,
            "strided_read": false,
            "strided_write": false,
            "gather_read": false,
            "scatter_write": false,
            "shared_read": false,
            "shared_write": false,
            "shared_memory_tiling": false,
            "reuses_input": false,